{
  "scenario_id": "golden_pothos_confirm_low_readings",
  "plant_id": "golden_pothos",
  "initial_state": {
    "reservoir_ml": 200.0
  },
  "observations": [
    {
      "timestamp": "2026-03-29T08:00:00+00:00",
      "soil_moisture": 0.1
    },
    {
      "timestamp": "2026-03-29T21:00:00+00:00",
      "soil_moisture": 0.1
    }
  ],
  "notes": "Confirmation-driven watering scenario for a dry-between profile."
}
