{
  "scenario_id": "unresolved_species_rejection",
  "plant_id": "christmas_cactus",
  "initial_state": {
    "reservoir_ml": 200.0
  },
  "observations": [
    {
      "timestamp": "2026-03-29T08:00:00+00:00",
      "soil_moisture": 0.1
    }
  ],
  "notes": "Replay input with a known unresolved species id from unresolved_species.json."
}
