{
  "scenario_id": "peace_lily_cooldown_boundary",
  "plant_id": "peace_lily",
  "initial_state": {
    "reservoir_ml": 200.0
  },
  "observations": [
    {
      "timestamp": "2026-03-29T08:00:00+00:00",
      "soil_moisture": 0.03
    },
    {
      "timestamp": "2026-03-29T13:59:00+00:00",
      "soil_moisture": 0.03
    },
    {
      "timestamp": "2026-03-29T14:00:00+00:00",
      "soil_moisture": 0.03
    }
  ],
  "notes": "Cooldown should block until the exact configured boundary, then allow watering."
}
